### ISSUE TITLE
[keepalived]: notify script fails to enable proxy arp with vlan interfaces

### ISSUE THREAD

**Issue by egon010** [rcbops/chef-cookbooks#757]
Vlan interfaces like eth0.VLAN are represented as eth0/VLAN in sysctl. The notify script uses just the interface nam, and fails to properly enable proxy arp.

**Comment by egon010** [comment]
Submitting a pull request for this issue.

**Comment by DavidWittman** [comment]
Related PR: https://github.com/rcbops-cookbooks/keepalived/pull/32

**Comment by breu** [comment]
The PR needs to be merged into v4.2.2rc

**Comment by cloudnull** [comment]
fixed, closing

**Comment by xeregin** [comment]
```
root@ian-controller:~# cat /etc/keepalived/notify.sh
.
.
.
# VLAN interfaces use a "." separator
# sysctl uses a "/" within the interface, and "." component delimeters.
# these switch the "." for a "/", but don't touch the original variables
SYSCTL_iface=${iface//.//}
SYSCTL_brif=${brif//.//}
.
.
.
ip netns exec $ns ip link set lo up
ip netns exec $ns ip addr add 169.254.123.2/30 dev $nsif
ip netns exec $ns sysctl net.ipv4.ip_forward=1
ip netns exec $ns sysctl net.ipv4.conf.${nsif}.arp_notify=1

sysctl net.ipv4.conf.${SYSCTL_iface}.proxy_arp=1
sysctl net.ipv4.conf.${SYSCTL_brif}.proxy_arp=1
sysctl net.ipv4.conf.lo.arp_ignore=1
sysctl net.ipv4.conf.lo.arp_announce=2
sysctl net.ipv4.ip_forward=1
.
.
.
```

**Comment by xeregin** [comment]
Listened on controller1, while bringing down controller2 (which had the vips). Got this output. Verified fixed...

```
root@ian-controller:~# tcpdump -i eth3 arp
tcpdump: verbose output suppressed, use -v or -vv for full protocol decode
listening on eth3, link-type EN10MB (Ethernet), capture size 65535 bytes
04:37:33.150981 ARP, Request who-has 192.168.4.18 tell ian-controller, length 28
04:37:33.153302 ARP, Reply 192.168.4.18 is-at bc:76:4e:10:0c:ca (oui Unknown), length 28
04:37:34.162106 ARP, Request who-has 192.168.4.22 tell ian-controller, length 28
04:37:34.164763 ARP, Reply 192.168.4.22 is-at bc:76:4e:11:00:d9 (oui Unknown), length 28
04:37:37.544904 ARP, Reply 192.168.4.154 is-at bc:76:4e:10:97:4c (oui Unknown), length 28
04:37:37.544958 ARP, Reply 192.168.4.155 is-at bc:76:4e:10:97:4c (oui Unknown), length 28
04:37:37.578017 ARP, Reply 192.168.4.156 is-at bc:76:4e:10:97:4c (oui Unknown), length 28
04:37:38.545070 ARP, Reply 192.168.4.155 is-at bc:76:4e:10:97:4c (oui Unknown), length 28
04:37:38.545327 ARP, Reply 192.168.4.154 is-at bc:76:4e:10:97:4c (oui Unknown), length 28
04:37:38.578141 ARP, Reply 192.168.4.156 is-at bc:76:4e:10:97:4c (oui Unknown), length 28
04:37:39.545227 ARP, Reply 192.168.4.155 is-at bc:76:4e:10:97:4c (oui Unknown), length 28
04:37:39.545656 ARP, Reply 192.168.4.154 is-at bc:76:4e:10:97:4c (oui Unknown), length 28
04:37:39.578245 ARP, Reply 192.168.4.156 is-at bc:76:4e:10:97:4c (oui Unknown), length 28
04:37:39.725045 ARP, Request who-has 192.168.4.49 tell ian-controller, length 28
04:37:40.724291 ARP, Request who-has 192.168.4.49 tell ian-controller, length 28
04:37:41.724275 ARP, Request who-has 192.168.4.49 tell ian-controller, length 28
04:37:42.724390 ARP, Request who-has 192.168.4.49 tell ian-controller, length 28
04:37:43.724278 ARP, Request who-has 192.168.4.49 tell ian-controller, length 28
04:37:44.724278 ARP, Request who-has 192.168.4.49 tell ian-controller, length 28
04:37:55.480273 ARP, Request who-has 192.168.4.18 tell ian-controller, length 28
04:37:55.481731 ARP, Reply 192.168.4.18 is-at bc:76:4e:10:0c:ca (oui Unknown), length 28
04:37:59.192273 ARP, Request who-has 192.168.4.22 tell ian-controller, length 28
04:37:59.193162 ARP, Reply 192.168.4.22 is-at bc:76:4e:11:00:d9 (oui Unknown), length 28
04:38:04.945762 ARP, Request who-has ian-controller tell ian-controller2, length 28
04:38:04.945777 ARP, Reply ian-controller is-at bc:76:4e:10:97:4c (oui Unknown), length 28
04:38:10.104271 ARP, Request who-has ian-controller2 tell ian-controller, length 28
04:38:10.105317 ARP, Reply ian-controller2 is-at bc:76:4e:11:71:19 (oui Unknown), length 28
04:38:10.796575 ARP, Request who-has 192.168.4.154 tell 192.168.4.49, length 28
04:38:11.352273 ARP, Reply 192.168.4.154 is-at bc:76:4e:10:97:4c (oui Unknown), length 28
04:38:16.360278 ARP, Request who-has 192.168.4.49 tell ian-controller, length 28
04:38:16.361257 ARP, Reply 192.168.4.49 is-at bc:76:4e:10:c2:0b (oui Unknown), length 28
04:38:19.496278 ARP, Request who-has 192.168.4.18 tell ian-controller, length 28
04:38:19.497262 ARP, Reply 192.168.4.18 is-at bc:76:4e:10:0c:ca (oui Unknown), length 28
04:38:23.192270 ARP, Request who-has 192.168.4.22 tell ian-controller, length 28
04:38:23.193336 ARP, Reply 192.168.4.22 is-at bc:76:4e:11:00:d9 (oui Unknown), length 28
04:38:30.753273 ARP, Request who-has 192.168.4.155 tell ian-controller2, length 28
04:38:31.108183 ARP, Request who-has 192.168.4.154 tell ian-controller2, length 28
.
.
.
```

**Comment by claco** [comment]
Reopen for backport to 4.1.5

**Comment by claco** [comment]
v4.1.5 was tested for a specific upgrade and released as is. Closing.
